{"$schema":"https://json-schema.org/draft/2020-12/schema","title":"Agent Fabric v1 local host configuration","type":"object","additionalProperties":false,"required":["version","role","expected_user","max_timeout_seconds","workspace_roots","ssh_aliases","allowed_runtimes"],"properties":{"version":{"const":1},"role":{"enum":["macbook","mac-mini"]},"expected_user":{"type":"string","minLength":1},"max_timeout_seconds":{"type":"integer","minimum":1,"maximum":3600},"workspace_roots":{"type":"object","minProperties":1,"additionalProperties":{"type":"string"}},"ssh_aliases":{"type":"object","additionalProperties":{"type":"string"}},"allowed_runtimes":{"type":"array","minItems":1,"uniqueItems":true,"items":{"enum":["pi","opencode","claude"]}},"activity_record":{"type":"string"}}}
